{
  "schema": "distraction-firewall/runtime-recovery/v1",
  "incidentId": "pretag-alpha2-runtime-uninstall-1603",
  "approvedForMachineRecovery": true,
  "mode": "repair_then_uninstall",
  "runtimeMsi": {
    "fileName": "distraction-firewall-runtime-recovery-1b676614-win-x64.msi",
    "size": 86290721,
    "sha256": "ef35d8ccb1a110f70dd4f6a9989bbc2b30a0b2b467b4fdc380ce6973b83c50da",
    "authenticodeStatus": "NotSigned",
    "productCode": "{1B676614-3B1F-4646-9788-889C071DAAA0}",
    "packageCode": "{AD62973E-B6B1-49B6-961B-C3688C7B9C26}",
    "upgradeCode": "{275EC377-2EB2-487F-AD4B-BA0BA85C2FFB}",
    "productVersion": "0.1.0"
  },
  "expectedInstalled": {
    "productCode": "{1B676614-3B1F-4646-9788-889C071DAAA0}",
    "packageCode": "{11A25941-6631-4793-8AD7-753985510F77}",
    "productVersion": "0.1.0",
    "localPackage": {
      "sizeBytes": 86282518,
      "sha256": "b9a94e0a2dbdc40ba3b0996fc5a304bf153d1e3e30ef8e0e7d420844bd300dfe"
    }
  },
  "orphanBundleProviderKeys": [
    "{247145F8-425B-46EA-B22F-560F2EE43DAE}"
  ],
  "orphanPackageCaches": [
    {
      "directoryName": "{40C25BD0-2C4F-4697-AE8D-42B6E24EBB41}v0.1.0",
      "dependencyProviderKey": "{40C25BD0-2C4F-4697-AE8D-42B6E24EBB41}_v0.1.0",
      "productCode": "{40C25BD0-2C4F-4697-AE8D-42B6E24EBB41}",
      "packageCode": "{85C80D60-7836-4F20-AC4D-EBB62CF7E663}",
      "upgradeCode": "{F6467493-5819-4046-900A-C9FDF87DF7C1}",
      "productVersion": "0.1.0",
      "payload": {
        "fileName": "distraction-firewall-app-0.1.0-alpha.2-win-x64.msi",
        "sizeBytes": 78274808,
        "sha256": "9a41cb076aceae9aede9028b7410c15a84150416c3fe657b7e6daff31bc2cc17"
      }
    },
    {
      "directoryName": "{1B676614-3B1F-4646-9788-889C071DAAA0}v0.1.0",
      "dependencyProviderKey": "{1B676614-3B1F-4646-9788-889C071DAAA0}_v0.1.0",
      "productCode": "{1B676614-3B1F-4646-9788-889C071DAAA0}",
      "packageCode": "{11A25941-6631-4793-8AD7-753985510F77}",
      "upgradeCode": "{275EC377-2EB2-487F-AD4B-BA0BA85C2FFB}",
      "productVersion": "0.1.0",
      "payload": {
        "fileName": "distraction-firewall-runtime-0.1.0-alpha.2-win-x64.msi",
        "sizeBytes": 86282518,
        "sha256": "b9a94e0a2dbdc40ba3b0996fc5a304bf153d1e3e30ef8e0e7d420844bd300dfe"
      }
    }
  ]
}
